article_title,updated_at,content,tokens
Utilizing Custom Attributes to Filter Invoice Line Items,2024-04-10T17:00:00Z,"Topic: Utilizing Custom Attributes to Filter Invoice Line Items

Content:
In BigTime's invoice system, the DataTable collection named expenseOtherChargeLines | FilteredLines is designed for specificity in invoice line item selection, particularly for ""time detail"" invoice types. This collection provides a mechanism for users to include adjustments, credits, and other modifications. The default configuration retrieves line items with LineType 50 (expenses) or 0 (custom).

Fields:
The fields within this collection mirror those available in the standard lines collection, maintaining consistency across different invoice types.

Custom Attributes:

LineTypeList:

To customize beyond the default filter, users can define a comma-separated list of line types they wish to include through the LineTypeList attribute. This filter excludes any line items where the LineTypeSid does not match the list.
CategoryList:

For custom invoice calculations, each line item can be associated with a term, such as ""retainers"" or ""deposits."" The CategoryList allows for the specification of line item term IDs, filtering only the desired categories.
ShowTypeAndCat:

The default behavior filters out line items that don't match the criteria in both LineTypeList and CategoryList. Setting the ShowTypeAndCat attribute to TRUE changes the filter logic to include line items that meet either the CategoryList or the LineTypeList conditions.
ng-include:

For filters requiring criteria beyond line type or category, ng-include provides a solution. It enables the inclusion of a formula that evaluates each line item against specific conditions. For instance, the formula ng-include=""LineType=0 AND Amt<0"" includes any line item with LineType=0 and an Amount less than 0.
Important Note:
The ng-include attribute has precedence over other custom attributes, meaning it can override any filters set by other attributes within this object.

This sophisticated filtering capability allows for precise control over which line items are included in an invoice, ensuring that only relevant items are displayed and calculated. It’s an essential feature for creating tailored invoices that accurately reflect the nuances of billing for services rendered.",421
Implementing the salesTaxList Collection in Invoice Design,2024-04-10T17:00:00Z,"Topic: Implementing the salesTaxList Collection in Invoice Design

Content:
In BigTime's invoice structure, the salesTaxList collection is an integral part that typically appears just after the line items on an invoice's first page, leading up to the ""total amount due"" line. This collection is particularly crucial for invoices subject to sales tax; however, it can be omitted where sales tax does not apply, such as in many US states. In such cases, the default invoices are designed with the salesTaxList dataTable, which is set to hide-if-empty=""true"" to maintain a clean look when no tax is applicable.

Here is an example breakdown of an invoice total:

Professional Fees: $10,000.00
Expenses: $2,500.00
Subtotal: $12,500.00
Illinois State Tax (6.25%): $625.00
Chicago Use Tax (5%): $500.00
Total: $13,625.00
The lines itemized for ""Illinois State Tax"" and ""Chicago Use Tax"" represent the application of different tax rates to the invoice line items. In contrast, the tax systems in Canada and the UK require a more detailed approach, such as different tax rates for separate line items and the consolidation of taxes for specific items. These systems necessitate breaking down the taxes into their components on the invoice.

The salesTaxList dataset contains detailed information on the taxes calculated by the invoice engine:

Fields:
taxNm: The tax name, e.g., ""Illinois State Tax.""
taxRt: The tax rate as a percentage, e.g., 6.25%.
taxAmt: The specific tax amount added, e.g., $625.00.
taxableAmt: The total amount from the invoice that is subject to tax, e.g., $10,000.00 in professional fees.
For customers in regions with more complex tax requirements, such as Canada and the UK, it's crucial to understand how the salesTaxList dataset interacts with the reimbursableTaxes dataset, as there may be overlap in data between the two.

The design and implementation of the salesTaxList collection are critical to the clarity and legal compliance of the invoice. Proper formatting and accurate calculation are imperative to ensure that the invoice reflects the correct taxes, facilitating a smooth transaction between businesses and their clients.
",484
Implementing reimbursableTaxes DataTable Collection in BigTime Invoice XML,2024-04-10T17:00:00Z,"Topic: Implementing reimbursableTaxes DataTable Collection in BigTime Invoice XML

Content:
In the BigTime system, the DataTable collection called reimbursableTaxes plays a crucial role for users who need to track taxes paid on reimbursable expenses. This feature is particularly pertinent for a subset of users, notably within Canada or the UK, who handle a large volume of reimbursable expenses and need to reflect these taxes accurately on their invoices.

When reimbursableTaxes is implemented in the invoice XML, it allows for the display of a summarized line item of all reimbursable taxes on the invoice's cover page. Additionally, users have the option to detail taxable amounts on a separate expense detail page. This flexibility caters to different reporting and billing requirements.

The fields within the reimbursableTaxes collection are defined as follows:

taxNm: This field represents the name of the tax rate being applied to the invoice (e.g., ""Illinois State Tax""). It is a text field that identifies the tax for clarity on the invoice.

taxRt: This numeric field specifies the percentage rate at which the tax is calculated. It can be formatted to show either a decimal (e.g., .0625) or a percentage (e.g., 6.25%), depending on the user's preference or regional standards.

taxAmt: This is the actual tax amount added for the type of tax to the invoice. For instance, if the taxRt is 6.25% and is applied to a taxable amount, the taxAmt would reflect the resultant tax figure in dollars and cents.

taxableAmt: This field indicates the total invoice amount subject to the specified tax. In scenarios where taxes are applied selectively (e.g., only to professional fees), the taxableAmt would reflect the total of the selectively taxed invoice items.

This structure is designed to provide transparency in tax calculations on invoices, ensuring that the tax breakdown is both understandable and auditable. It aids in creating an invoice that is compliant with regional tax laws and clear for clients to review and process payments.",421
Leveraging agingReport and projectAgingReport DataSets for Invoice Clarity,2024-04-10T17:00:00Z,"Topic: Leveraging agingReport and projectAgingReport DataSets for Invoice Clarity

Content:
This article delves into the advanced use of DataTable collections, specifically the agingReport and projectAgingReport, in BigTime invoices to communicate outstanding balances effectively.

When firms wish to remind customers of previous outstanding invoices, they incorporate the agingReport DataSet into the current invoice. This makes it apparent that the customer's obligation exceeds the current invoice, deterring the assumption that payment of the current invoice settles their account in full.

However, including past-due balances can sometimes lead to payment confusion. To mitigate this, the option to ""show prior balances in total balance due"" is often enabled when using the agingReport. This aggregates previous balances without cluttering the cover page.

For invoices pertaining to specific projects, especially when billing various departments within the same firm, the projectAgingReport is more suitable. It lists only the outstanding invoices related to the specific project being billed, preventing cross-project confusion.

Custom Attributes:

ShowOverallARTotal: When set to TRUE, this adds the sum of all previous unpaid invoices to the ""balance due"" in the invoice summary. It's crucial to ensure the invoice's total remains unchanged to avoid presenting multiple due amounts.
projectOnlyAR: This works in tandem with ShowOverallARTotal to ensure that the ""past due"" amount reflects only the arrears pertinent to the project for which the invoice is issued.
These custom attributes, while listed under the agingReport collection, are typically associated with the table object displaying past balance and payment history. They can also be applied to the lines collection with the same effect.

Fields:

ClientNm to DaysOutstanding: These fields capture the detailed information of each outstanding invoice, such as client name, invoice number, dates associated with the invoice, amounts, and payment status.
Consolidated: Indicates whether the invoice is a consolidated one.
LastPaymentAmt, LastPaymentDate, and LastPaymentType: Provide details on the most recent payments for partially paid invoices.
The fields TotalAmt and TotalAmtDue appear to be placeholders for total amounts that might require further context or clarification within the invoice.
The use of these fields and custom attributes in the DataTable collection can significantly enhance the clarity and precision of invoices, especially when dealing with complex billing scenarios. It's essential to apply these elements thoughtfully to maintain simplicity and avoid any potential confusion for the customer.",485
Effective Use of Budget Status in Progress and Milestone Invoices,2024-04-10T17:00:00Z,"Topic: Effective Use of Budget Status in Progress and Milestone Invoices

Content:
For invoices that are tethered to a fixed budget, such as those for progress billing or milestone achievements, it's a common practice to include a budget status summary. This summary is crucial for firms to present a transparent account of the overall project budget, the amount previously billed, the current billings, and the budget remaining, with each invoice iteration.

The budgets dataTable collection is crucial in this aspect. It derives from the tasks associated with the invoiced project. The following custom attributes are particularly important as they provide flexibility in how this budget data is presented:

excludeArchivedTasks: When set to true, this attribute excludes tasks that are marked as 100% complete and have no billings in the current invoice. This keeps the focus on relevant tasks.

excludeUnbilledTasks: If the aim is to display only the tasks that are being billed in the current invoice cycle, setting this attribute to true will filter the tasks accordingly.

excludeTasksWithoutBudgets: To display only those tasks that have an allocated fee or expense budget, this attribute should be set to true. This is particularly useful for invoices concerning projects with mixed-billing requirements.

taskView: This attribute enables subtotaling of tasks based on their grouping within the task list. The taskView can be set to various values such as flat, grouponly, or taskgroup, depending on the desired presentation of tasks within the invoice.

It is also noted that including both the budgets collection and the lines collection (which may show redundant information) on the same invoice is not recommended due to the potential confusion it may cause to the end customer. It's advisable to use one or the other to maintain clarity.

This level of customization in presenting budget information is designed to meet diverse billing practices and to ensure clarity in communication with the client regarding the financial status of the project.",384
Utilizing DataTable Collections for Time Entry Details on Invoices,2024-04-10T17:00:00Z,"Topic: Utilizing DataTable Collections for Time Entry Details on Invoices

Content:
Incorporating a detailed list of time entries on an invoice is a common request from customers using BigTime's invoicing system. To fulfill this, a dataTable for the time dataSet should be added to the invoice's XML format.

The time dataSet can include any field that is available in the 'Timesheet Detail' report type. Here's a guide on how to leverage these fields:

Identifying Fields:

Begin by creating a custom 'Timesheet Detail' report within BigTime. This process is outlined in another section of the document, which provides instructions for creating and reviewing custom reports.
Once the custom report is generated, you will be able to view all the fields that can be included in the time dataSet for your invoice.
Using API to Retrieve Field Names:

To use the fields in your invoice dataTable, employ the API to pull the field names from your custom 'Timesheet Detail' report.
With the field names obtained, you can integrate them into your invoice format, ensuring that your invoice displays all necessary time entry details.
Custom Attributes:

excludeNoChargeItems: By setting this attribute to TRUE, you can filter out any time entries marked as “no charge” from your invoice's time entry list.
itemBasedTemplate: When set to TRUE, this attribute will exclude time entries associated with fixed-fee type tasks from the dataset.
In summary, the dataTable collection for time provides a customizable approach to presenting time entry data on invoices. By following the steps to create a custom report and using the API to fetch field names, you can tailor the time entry details to your specific billing requirements, ensuring your invoices are both informative and tailored to the billing needs of your projects.",352
Utilizing the DataTable Collection for Expenses in BigTime Invoices,2024-04-10T17:00:00Z,"Topic: Utilizing the DataTable Collection for Expenses in BigTime Invoices

Content:
The integration of expense data into invoices is a frequent requirement from customers who wish to include all expenses related to the current invoice. This is achieved by embedding a dataTable for the expenses dataset within the invoice XML format.

When incorporating expense data, any field from an expense detail report can be utilized. This vast selection is not listed exhaustively in this document; instead, we provide a method to identify and use these field names effectively:

Field Identification:

Report Type: To determine which fields are available for inclusion, you must create a custom report using the 'Expense Detail' report type. Detailed instructions for creating and reviewing custom reports are provided elsewhere in this documentation.
API Usage: Once the custom expense detail report is configured, you can use the BigTime API to extract the field names from that report. These field names are then used within your invoice's dataTable.
Custom Attributes:

excludeNoChargeItems: By setting this attribute to TRUE, you can exclude any entries labeled as ""no charge"" from the invoice's list of entries. This ensures that only billable expenses are displayed.
itemBasedTemplate: This attribute, when set to TRUE, will omit entries linked to fixed-fee type tasks from the dataset. This is useful for invoices that should only reflect variable expenses.
The above approach allows for a high degree of customization when it comes to displaying expenses on invoices, ensuring that the data presented is both relevant and tailored to specific billing requirements.

The technical details provided here are critical to implementing a customized invoice format that includes comprehensive expense data, facilitating a clear and detailed billing document for the client.
",335
Integrating Time and Expense Details in Invoices Using Transaction Lists,2024-04-10T17:00:00Z,"Topic: Integrating Time and Expense Details in Invoices Using Transaction Lists

Content:
The capability to combine both time and expense details on a single invoice is a significant efficiency for BigTime users. Instead of generating two separate dataTable objects for time and expense, the system allows for a combined ""transaction"" list.

Structure and Grouping:
This combined list, or 'transaction type' dataset, is typically grouped first by the transaction type, distinguishing between total fees and total expenses, and then by other categories. The flexibility of this approach means users can tailor the dataset to their specific needs.

Field Names and Report Types:
Users can utilize any field from the transaction detail report type within this dataSet. However, to maintain the document's focus, all possible fields are not listed here. Instead, the document will guide users on how to view field names for a custom transaction detail report and extract those field names using the API. This method ensures that the most relevant and up-to-date fields are used in the invoice dataTable.

Custom Report Creation:
For custom reports, users should select the Time+Expense Detail report type. Detailed instructions on creating and reviewing custom reports are provided in another section of the document. These instructions are crucial for understanding which fields can be included in the dataSet.

Custom Attributes:
There are specific attributes users can set to refine the data included in the dataTable:

excludeNoChargeItems: When set to TRUE, this attribute excludes any entries labeled ""no charge"" from the displayed list on the invoice.
itemBasedTemplate: When set to TRUE, this attribute will exclude entries linked to fixed-fee type tasks from the resulting dataset.
These attributes help ensure the data presented in the invoice is precisely what the user intends, allowing for clear and concise invoicing that facilitates easy payment processing and reflects the work done accurately.",363
Implementing Summarized Time Reporting via DataTable Collections in Invoices,2024-04-10T17:00:00Z,"Topic: Implementing Summarized Time Reporting via DataTable Collections in Invoices

Content:
The BigTime system allows firms to display time on invoices in a summarized form through the use of the DataTable collection named timesummary. This feature is particularly useful for firms that prefer a consolidated view of time data rather than a detailed enumeration.

When opting for a summarized time report on an invoice, BigTime leverages the comprehensive set of fields available in its reporting engine. To explore the fields applicable for this dataset, the user is directed to a resource that outlines the process of creating and reviewing custom reports. This resource is crucial for understanding the extent of customization available for the timesummary dataset. Users should select the 'Timesheet Summary' report type when aligning custom reports with this dataset.

Additionally, the timesummary dataset can be configured with custom attributes to refine the data displayed:

excludeNoChargeItems: By setting this attribute to TRUE, any time entries marked as “no charge” are omitted from the summary on the invoice. This attribute is critical for ensuring that only billable time is summarized and presented to the client.

itemBasedTemplate: This attribute, when set to TRUE, excludes time associated with fixed-fee tasks from the summary. It allows firms to tailor the summarized data further, ensuring that the invoice reflects the most relevant and chargeable time entries.

These custom attributes provide firms with the flexibility to present their time data in a way that aligns with their billing practices and client expectations. The summarized view enabled by the timesummary collection not only streamlines the information presented on the invoice but also aids in clear communication of billable time to the client.",335
Utilizing DataTable Collections for Summarized Expense Reporting on Invoices,2024-04-10T17:00:00Z,"Topic: Utilizing DataTable Collections for Summarized Expense Reporting on Invoices

Content:
In BigTime's invoicing system, there is functionality that allows firms to display summarized expenses on invoices. The expenseSummary DataTable Collection is specifically designed for this purpose. This collection provides a summarized view of expenses rather than a detailed account, which can be preferable for certain invoices.

To implement a summarized expense report on an invoice, firms can utilize various fields from the reporting engine. These fields allow for a customizable summary that fits the firm's specific reporting needs. Rather than enumerating all potential fields here, firms are encouraged to explore the reporting engine. By following the instructions for creating and reviewing custom reports found elsewhere in the document, users can gain an understanding of which fields can be incorporated into the expenseSummary dataSet.

Fields:

Report Type: Select ""Expense Summary"" when creating custom reports to view and choose the fields available for inclusion within the expenseSummary dataSet.
Custom Attributes:

excludeNoChargeItems: When set to TRUE, this attribute will filter out any expenses marked as “no charge” from the summary on the invoice. This allows firms to only show chargeable expenses, keeping the summary relevant to the receivable amounts.
itemBasedTemplate: This attribute, when set to TRUE, ensures that the summary excludes expenses related to fixed-fee type tasks. This is particularly useful for firms that need to differentiate between variable expenses and fixed costs for clarity on the invoice.
By leveraging these settings, firms can tailor the expense information presented on an invoice to provide a clear and concise summary. This approach can enhance the readability of the invoice, making it easier for clients to understand and process the charges.",336
Utilizing the transactionsummary DataTable Collection in Invoices,2024-04-10T17:00:00Z,"Topic: Utilizing the transactionsummary DataTable Collection in Invoices

Content:
The transactionsummary collection in BigTime's invoice templates allows firms to display summarized time and expenses, providing a high-level view of billable items. This collection is especially useful for firms that prefer summarization over detailed line item reports.

To configure this summary view, one can leverage the same fields available in BigTime's reporting engine. While this document does not list every field, users can explore the available fields for this particular dataset by following a guide linked below, which details how to create and review custom reports. To align custom reports with this summary, select the ""Time+Expense Summary"" report type.

Additionally, there are custom attributes available that can refine what is included in the summary:

excludeNoChargeItems: When set to TRUE, this attribute omits any time or expense entries marked as ""no charge"" from the invoice summary.

itemBasedTemplate: When set to TRUE, this attribute ensures that time and expense entries associated with fixed-fee tasks are not included in the summary.

These attributes are instrumental in customizing the invoice summary to meet specific requirements, ensuring clarity and precision on the invoice presented to the client.",241
Extracting Field Names for Invoice DataSets from Custom Reports in BigTime,2024-04-10T17:00:00Z,"Topic: Extracting Field Names for Invoice DataSets from Custom Reports in BigTime

Content:
The flexibility of BigTime's reporting engine allows for the inclusion of any supported field within your invoice dataSets. To identify and utilize specific field names in your invoice dataSet, follow these detailed steps:

Creating a Custom Report:

Start by creating a custom report and ensure you select the proper report type.
Add the columns that you want to appear in your invoice report. It's important to focus on the columns, as the invoicing engine will handle the data rows, filters, groupings, and subtotals when generating each invoice.
Identifying the Report's URL:

After creating the report, take note of its URL, which contains the report's unique system ID.
For instance, in a URL like https://iq.bigtime.net/Bigtime/Report2#/detail/88, the number 88 is the report's system ID.
Utilizing the API Documentation:

Navigate to the BigTime API documentation.
Input the endpoint report/detail/{systemId}, replacing {systemId} with the actual ID, into the REST test URL box provided at the documentation's page bottom.
Retrieving the JSON Definition:

Executing the above will return the JSON definition of your custom report.
Within this JSON, you'll find entries for each column, complete with a ""name"" field that corresponds to the field names usable in your invoice dataTable.
For example, if your custom report includes time-related data, your JSON result should display field names like tmprojectnm and tmstaffnm. These can then be incorporated into your invoice dataTable that uses 'time' as its dataset, as shown below:

xml
Copy code
<dataTable collection=""time"" showRptTotal=""1"" sort1=""TMDt"">
    <heading style="""" class=""TitleFont HeaderTitle"">TIME DETAILS</heading>
    <fld label=""Date"" style=""width:99;text-align:right;"">TMDt</fld>
    <fld label=""Project"" style=""width:110;"">tmprojectnm</fld>
    <fld label=""Consultant"" style=""width:130"">tmstaffnm</fld>
    <fld label=""Description"">TMNotes</fld>
    <fld label=""Hours"" style=""width:88;text-align:right;"">TMHrsBill2</fld>
    <fld label=""Rate"" style=""width:90;text-align:right;"">TMBillRate</fld>
    <fld label=""Amount"" style=""width:110;text-align:right;"">TMChgBill</fld>
</dataTable>
Following these instructions will enable you to accurately pull field names for use in your invoice templates, ensuring that your invoices include all necessary details from your custom reports.",563
